{
  "schema_id": "asset-mania/reconstruction-plan",
  "schema_version": "1.0",
  "engine": "triposr-local",
  "engine_profile": "triposr-local-cpu-v1",
  "clearance_sha256": "d55b755efd5f4a31466df4929c1b8da8e894f876901fd2f2775a92b2a2a613dd",
  "source_image_sha256": "f1f1f1f1f1f1f1f1f1f1f1f1f1f1f1f1f1f1f1f1f1f1f1f1f1f1f1f1f1f1f1f1",
  "source_width": 1024,
  "source_height": 1024,
  "color_space": "srgb",
  "alpha": "straight",
  "mask_sha256": null,
  "background_removal_clearance_sha256": "d55b755efd5f4a31466df4929c1b8da8e894f876901fd2f2775a92b2a2a613dd",
  "asset_kind": "face_head",
  "subject": "real_person",
  "rights_receipt_sha256": "f3f3f3f3f3f3f3f3f3f3f3f3f3f3f3f3f3f3f3f3f3f3f3f3f3f3f3f3f3f3f3f3",
  "expected_output": {
    "mesh_format": "glb",
    "textured": false,
    "unit_scale_meters": 1.0
  },
  "overwrite_policy": "create_only",
  "plan_sha256": "6f79a0b7a87db006ee0ad50b09d123cff6015c8f8efc2b266ca3626db38fd700"
}
